Index,date Creation,date Actualisation,Offres d'emploi,Missions,Compétences,Qualifications Pro,Types de contrat,Lieu de travail,Entreprise,Qualifications
0,2023-04-30T02:49:33.000Z,2023-04-30T02:49:33.000Z,Data Scientist en Santé H/F,"La sociétéCréée en 2021, AbilyCare est une start-up technologique française qui promeut une médecine préventive, prédictive et personnalisée à tout âge, via la mesure quantifiée de la motricité (marche, équilibre.)AbilyCare accompagne les entreprises, les acteurs de la santé et du social, dans les trois niveaux de la prévention : primaire pour empêcher la survenue d'une maladie ou d'un accident en agissant sur les trajectoires individuelles à risque (vieillissement, TMS .), secondaire en intervenant sur le dépistage, l'aide au diagnostic précoce des pathologies et de la fragilité et tertiaire pour évaluer la progression d'une pathologie avérée et de son processus de rééducation.Basée en Île-de-France, incubée au sein de Paris&Co TechCare et accélérée par Wilco, AbilyCare s'appuie sur un portefeuille de quatre familles de brevets, et commercialise un dispositif médical logiciel permettant d'avoir un impact sociétal fort et de contribuer à l'objectif 3 de développement durable défini par l'ONU : « Permettre à tous de vivre en bonne santé et promouvoir le bien-être de tous à tout âge ».Dans le contexte de cette nouvelle étape de son développement, AbilyCare recherche son futur Data Scientist.

MissionVous prenez vos fonctions dans le cadre de la création d'un poste au sein de notre ;Vous aurez la charge de gérer tous les aspects scientifiques de la donnée manipulée par le dispositif médical et serez notamment le fer de lance de la recherche de la société, en lien avec la directrice technique, la directrice médical et le directeur général. Au-delà de l'aspect recherche, vous participerez à la mise en production et à la maintenance/amélioration opérationnelle des algorithmes.Vous devrez d'abord vous approprier l'existant, notamment sur des algorithmes brevetés. Très vite vous aurez en charge de faire évoluer ces algorithmes pour répondre aux exigences et aux sollicitations métiers.Vous interviendrez sur des éléments stratégiques de la roadmap avec, pour chaque évolution :Recueil des besoins auprès de l'équipe métier et des utilisateurs,Définition des nouvelles fonctionnalités, des solutions et des outils à mettre en place,Mise en place des solutions, développement des algorithmes,Validation sur nos jeux de données ou des bases ouvertes,Participation à la conception et à l'analyse de données des essais cliniques,Qualification,Mise en production,Surveillance et maintien en conditions opérationnellesBref, vous interviendrez sur toute la chaine de valeur, de la mesure capteur à la restitution aux utilisateurs, de la contextualisation à l'interprétation des données.Évidemment vous serez en veille perpétuelle sur votre domaine en évolution continue et vous pourrez être amené à collaborer avec le monde acadé ;

Vos responsabilitésGarant de la disponibilité de la qualité des données, vous devrez extraire le meilleur des données par des algorithmes pointus.Votre rôle sera de transformer des données informatiques en données médicales convaincantes afin de leur donner du sens pour un professionnel de santé et de l'aider dans son diagnostic, pour une médecine prédictive et personnalisée.Dans un contexte de confidentialité des données liés au caractère confidentiel des données de santé.

Vos atoutsDiplômé d'une grande école ou équivalent, et spécialisé en mathématiques appliquées ou en data science, vous aimez les défis et résoudre des problèmes complexes.Vous avez une première expérience en R&D (thèse, post-doc, bureau d'étude.) et faites preuve d'autonomie.Cartésien, vous avez à cœur de valider les briques algorithmiques pour construire des solutions puissantes et fiables.Ouvert d'esprit, curieux et pédagogue, vous êtes en mesure de dialoguer et d'expliquer vos travaux avec des interlocuteurs techniques comme non techniques.La connaissance du secteur de la santé et des contraintes réglementaires associées (gestion de l'information médicale, interopérabilité) est un plus.

Compétences requisesMathématiques appliquées, automatique,Modèle et fusion de données,Intelligence artificielle, machine learning,Python,Gestion de projet, documentation ;

Les bonnes raisons de nous rejoindreEn rejoignant AbilyCare, vous aurez la chance de participer à la création d'une solution à fort impact sociétal et d'inventer la santé préventive de demain, dans le respect de nos valeurs: Bienveillance, Clarté, Exigence, Conviction.", , ,CDI,"{'libelle': '75 - PARIS 01', 'latitude': 48.832, 'longitude': 2.356, 'codePostal': '75001', 'commune': '75101'}","{'nom': 'AbilyCare', 'entrepriseAdaptee': False}", 
1,2023-04-17T15:58:13.000Z,2023-04-17T15:58:13.000Z,Project Manager Data - Secteur santé F/H - Informatique de gestion (H/F),"Descriptif du poste:

Ce Que Nous Allons Accomplir Ensemble
Rejoignez un acteur majeur du domaine de la santé !
L objectif de notre partenaire est de développer le pôle data au sein de son laboratoire scientifique. Ainsi, vous serez chargé(e) d apporter un soutien à l équipe informatique spécialisée en recherche et développement autour des soins médicaux.
Votre Future Équipe
Notre équipe d Astekiens vous accueillera avec plaisir en tant que Project Manager Data.
Votre mission ( si vous l acceptez !) :
Assurer la gestion des plannings
Mener à bien les différents projets
Créer les chartes du projet
Assurer le rendu des livrables à temps
Participer à la gestion budgétaire
Animer les réunions d équipe et assurer la coordination avec les autres PM
Rédiger la documentation en anglais.
 
Les Petits Plus Du Projet
Vous aurez l occasion de mettre en place l Agilité sur des projets innovants autour de la création d environnement data sciences.
 
Le Groupe Astek
Créé en France en 1988, Astek est un acteur mondial de l ingénierie et du conseil en technologies, présent sur les 5 continents. Fort de son expertise dans de nombreux secteurs industriels et tertiaires, Astek accompagne ses clients internationaux dans le déploiement intelligent de leurs produits et de leurs services, et dans la mise en œuvre de leur transformation digitale.
Depuis sa création, le Groupe a fondé son développement sur une forte culture d entrepreneuriat et d innovation, et sur l accompagnement et la montée en compétence de ses 7 200 collaborateurs qui s engagent chaque jour à promouvoir la complémentarité entre les technologies numériques et l ingénierie des systèmes complexes.
Rejoignez un Groupe en fort développement en France et à travers le monde ayant réalisé un chiffre d affaires de 500 M en 2022.
Tous les détails sur le Groupe sur le site astekgroup.fr. Et vous pouvez aussi nous suivre sur notre blog.
Nos plus
Astek est green et fait bénéficier ses salariés d une indemnité kilométrique vélo
Une politique CARE sur-mesure déployée par nos équipes RH pour nos collaborateurs
Notre charte de la Diversité
Rencontrons-nous !
Vous vous êtes reconnu sur l annonce et Astek vous plaît ?
Alice, notre incroyable Talent Acquisition Officer, vous contacte pour en savoir plus sur vous.
Manon, votre future manager, vous parle du projet, de l'équipe et de vos perspectives d'évolution.
Le Dicton préféré de votre futur Coach :
« Tout est possible à qui rêve, ose, travaille et n abandonne jamais » - Xavier Dolan
Bienvenue dans la team ! Allez-y, maintenant c est à vous de jouer !
Mots-clés : ingénieur ingénieure consultant consultante PM Agilité

Profil recherché:

Vous ?
Diplômé(e) d une Ecole d ingénieur ou équivalent de niveau Bac+5, vous justifiez d une solide expérience sur un poste similaire en tant que Project Manager Data.
Vous faites preuve de bonnes capacités de communication et de sens de la rigueur.
Vous disposez également d un niveau intermédiaire en anglais (niveau B2 requis).", , ,CDI,"{'libelle': '31 - TOULOUSE', 'latitude': 43.604082, 'longitude': 1.433805, 'codePostal': '31000', 'commune': '31555'}","{'nom': 'ASTEK', 'description': 'Le Groupe AstekCréé en France en 1988, Astek est un acteur mondial de l ingénierie et du conseil en technologies, présent sur les 5 continents. Fort de son expertise dans de nombreux secteurs industriels et tertiaires, Astek accompagne ses clients internationaux dans le déploiement intelligent de leurs produits et de leurs services, et dans la mise en œuvre de leur transformation digitale.Depuis sa création, le Groupe a fondé son développement sur une forte culture d entrepreneuri...', 'entrepriseAdaptee': False}", 
2,2023-04-12T21:44:00.000Z,2023-04-12T21:44:00.000Z,Data analyste informatique Santé Prévoyance (IT) / Freelance (H/F),"3 jours sur site
Définir les chantiers de préparation de données 
Réaliser les modèles conceptuels des données, les modèles de cas dutilisations 
Rédiger les spécifications fonctionnelles détaillées 
Réaliser la documentation groupe des données (dictionnaires de données, catalogue 
Connaissance santé/prévoyance est un plus
Profil candidat:
Clarifier les besoins et sassure de sa bonne compréhension. 
Contribuer aux POC, pour explorer les données utiles 
Définir les chantiers de préparation de données 
Réaliser les modèles conceptuels des données, les modèles de cas dutilisations 
Rédiger les spécifications fonctionnelles détaillées 
Réaliser la documentation groupe des données (dictionnaires de données, catalogue 
Connaissance santé/prévoyance est un plus", , ,LIB,"{'libelle': '75', 'commune': '75056'}",{'entrepriseAdaptee': False}, 
3,2023-04-08T06:18:18.000Z,2023-04-21T08:27:26.000Z,Manager/Senior Manager Data-Santé Social et Emploi - Courbevoie (H/F),"A propos de Sopra Steria NextSopra Steria Next est la marque de conseil en transformation digitale du Groupe Sopra Steria. Ses 3 400 consultants en Europe conçoivent des stratégies visionnaires, réellement actionnables et s'engagent sur des résultats tangibles pour les entreprises, leurs collaborateurs et leurs clients.Sopra Steria Next fait partie du Groupe Sopra Steria, l'un des leaders européens de la Tech reconnu pour ses activités de conseil, de services numériques et d'édition de logiciels. Le Groupe apporte une réponse globale aux enjeux de compétitivité des grandes entreprises et organisations, combinant une connaissance approfondie des secteurs d'activité et des technologies innovantes à une approche résolument collaborative. Sopra Steria place l'humain au centre de son action et s'engage auprès de ses clients à tirer le meilleur parti du digital pour construire un avenir positif. Fort de 47 000 collaborateurs dans près de 30 pays, le Groupe a réalisé un chiffre d'affaires de 4,7 milliards d'euros en 2021.The world is how we shape it. Pour plus d'informations, retrouvez-nous sur http://www.soprasterianext.frRejoignez l'équipe Conseil Santé Social Emploi de Sopra Steria Next pour accompagner les grands organismes des domaines de la santé, du social et de l'emploi dans leurs programmes de transformation. Votre rôle et tâchesVous accompagnez les Directions Générales, les métiers et les DSI dans leur transformation digitale :Participation à la conception et à la mise en œuvre d'une vision et d'une stratégie data. Structuration et appui à la mise en œuvre de la gouvernance et du management des données à l'échelle de l'organisation ou de domaines métiers / SI.Appui à la valorisation des données structurées ou non en mettant à profit l'ensemble des techniques de business intelligence, data analysis, data visualisation, data science et d'intelligence artificielleL'aide aux choix d'outils Ce que nous vous proposonsDévelopper vos compétences via nos dispositifs de formations multimodalesTravailler en synergie avec d'autres structures Data (Datalab, Architectes Data, Centre d'Excellence Digitale) afin de continuer à progresser sur des thématiques DataConstruire un avenir positif en mettant le digital au service de l'humainEvoluer dans une entreprise qui encourage l'audace, la curiosité et l'envie d'entreprendre Votre profil Vous êtes diplômé(e) d'une école d'Ingénieurs, de Commerce ou d'une UniversitéVous disposez d'une expérience d'au moins 4 ans sur des thématiques liées à la dataVous avez des connaissances en gouvernance, management ou en valorisation des données et/ou en usage d'outils de data visualisation ou de data managementVous disposez de qualités rédactionnelles, de capacités d'analyse, du sens du service, d'un esprit entrepreneurial et d'un vrai sens du collectifVous aimez le challenge, détecter et réaliser des tâches à impact Chez Sopra Steria, nous sommes engagés pour lutter contre toute forme de discrimination. Nous favorisons un environnement de travail inclusif et respectueux de toutes les différences. Tous nos postes sont ouverts aux personnes en situation de handicap. https://www.soprasteria.fr/nous-connaitre/nos-engagements", , ,CDI,{'libelle': '75 - Paris (Dept.)'},"{'nom': 'Forum Emploi-Formation-Alternance: Talents Handicap', 'entrepriseAdaptee': False}", 
4,2023-03-22T07:23:50.000Z,2023-04-26T02:55:19.000Z,Consultant manager - Data Management - Santé Social Emploi - Île-de-France (H/F),"Votre rôle et votre mission Rejoignez l'équipe Conseil Santé Social Emploi de Sopra Steria Next pour accompagner les grands organismes des domaines de la santé, du social et de l'emploi dans leurs programmes de transformation.Votre rôle et missionsVous accompagnez les Directions Générales, les métiers et les DSI dans leur transformation digitale :Participation à la conception et à la mise en œuvre d'une vision et d'une stratégie data. Structuration et appui à la mise en œuvre de la gouvernance et du management des données à l'échelle de l'organisation ou de domaines métiers / SI.Appui à la valorisation des données structurées ou non en mettant à profit l'ensemble des techniques de business intelligence, data analysis, data visualisation, data science et d'intelligence artificielleL'aide aux choix d'outilsCe que nous vous proposonsDévelopper vos compétences via nos dispositifs de formations multimodalesTravailler en synergie avec d'autres structures Data (Datalab, Architectes Data, Centre d'Excellence Digitale) afin de continuer à progresser sur des thématiques DataConstruire un avenir positif en mettant le digital au service de l'humainEvoluer dans une entreprise qui encourage l'audace, la curiosité et l'envie d'entreprendre Votre profil Votre profil Vous êtes diplômé(e) d'une école d'Ingénieurs, de Commerce ou d'une UniversitéVous disposez d'une expérience d'au moins 4 ans sur des thématiques liées à la dataVous avez des connaissances en gouvernance, management ou en valorisation des données et/ou en usage d'outils de data visualisation ou de data managementVous disposez de qualités rédactionnelles, de capacités d'analyse, du sens du service, d'un esprit entrepreneurial et d'un vrai sens du collectifVous aimez le challenge, détecter et réaliser des missions à impact Chez Sopra Steria, nous sommes engagés pour lutter contre toute forme de discrimination. Nous favorisons un environnement de travail inclusif et respectueux de toutes les différences.Tous nos postes sont ouverts aux personnes en situation de handicap. A propos de nous A propos de Sopra Steria NextSopra Steria Next est la marque de conseil en transformation digitale du Groupe Sopra Steria. Ses 3 400 consultants en Europe conçoivent des stratégies visionnaires, réellement actionnables et s'engagent sur des résultats tangibles pour les entreprises, leurs collaborateurs et leurs clients. The world is how we shape it. Pour plus d'informations, retrouvez-nous sur", , ,CDI,"{'libelle': '75', 'commune': '75056'}",{'entrepriseAdaptee': False}, 
